"id","isbn13","title","authors","published_date","page_count","category","language","avg_rating","rating_count","img_url","preview_url","description"
"531","9781416591061","Empire of the Summer Moon","S. C. Gwynne","2010","400","Biography and Autobiography","en","4.2","465","https://images.isbndb.com/covers/10/61/9781416591061.jpg","http://books.google.com.vn/books?id=YBnqAgAAQBAJ&printsec=frontcover&dq=isbn:9781416591061&hl=&cd=1&source=gbs_api","Finalist for the Pulitzer Prize This stunning historical account of the forty-year battle between Comanche Indians and white settlers for control of the American West was a major New York Times bestseller. In the tradition of Bury My Heart at Wounded Knee, a stunningly vivid historical account of the forty-year battle between Comanche Indians and white settlers for control of the American West, centering on Quanah, the greatest Comanche chief of them all. S. C. Gwynne's Empire of the Summer Moon spans two astonishing stories. The first traces the rise and fall of the Comanches, the most powerful Indian tribe in American history. The second entails one of the most remarkable narratives ever to come out of the Old West: the epic saga of the pioneer woman Cynthia Ann Parker and her mixed-blood son Quanah, who became the last and greatest chief of the Comanches. Although readers may be more familiar with the tribal names Apache and Sioux, it was in fact the legendary fighting ability of the Comanches that determined just how and when the American West opened up. Comanche boys became adept bareback riders by age six; full Comanche braves were considered the best horsemen who ever rode. They were so masterful at war and so skillful with their arrows and lances that they stopped the northern drive of colonial Spain from Mexico and halted the French expansion westward from Louisiana. White settlers arriving in Texas from the eastern United States were surprised to find the frontier being rolled backward by Comanches incensed by the invasion of their tribal lands. So effective were the Comanches that they forced the creation of the Texas Rangers and account for the advent of the new weapon specifically designed to fight them: the six-gun. The war with the Comanches lasted four decades, in effect holding up the development of the new American nation. Gwynne's exhilarating account delivers a sweeping narrative that encompasses Spanish colonialism, the Civil War, the destruction of the buffalo herds, and the arrival of the railroads--a historical feast for anyone interested in how the United States came into being. Against this backdrop Gwynne presents the compelling drama of Cynthia Ann Parker, a lovely nine-year-old girl with cornflower-blue eyes who was kidnapped by Comanches from the far Texas frontier in 1836. She grew to love her captors and became infamous as the ""White Squaw"" who refused to return until her tragic capture by Texas Rangers in 1860. More famous still was her son Quanah, a warrior who was never defeated and whose guerrilla wars in the Texas Panhandle made him a legend. S. C. Gwynne's account of these events is meticulously researched, intellectually provocative, and, above all, thrillingly told. Empire of the Summer Moon announces him as a major new writer of American history."
"532","9780544102767","Short Nights of the Shadow Catcher","Timothy Egan","2012","0","Biography and Autobiography","en","1.3","109","https://images.isbndb.com/covers/27/67/9780544102767.jpg","http://books.google.com.vn/books?id=-TvwjwEACAAJ&dq=isbn:9780544102767&hl=&cd=1&source=gbs_api","National Book Award-winning writer Timothy Egan tells the riveting, cinematic story behind the most famous photographs in Native American history -- and the driven, brilliant man who made them."
"533","9780425247853","Code Talker","Chester Nez, Judith Schiess Avila","2012-08-07","0","History","en","0.3","441","https://images.isbndb.com/covers/78/53/9780425247853.jpg","http://books.google.com.vn/books?id=LYyNEAAAQBAJ&dq=isbn:9780425247853&hl=&cd=1&source=gbs_api","The first and only memoir by one of the original Navajo code talkers of WWII. His name wasn’t Chester Nez. That was the English name he was assigned in kindergarten. And in boarding school at Fort Defiance, he was punished for speaking his native language, as the teachers sought to rid him of his culture and traditions. But discrimination didn’t stop Chester from answering the call to defend his country after Pearl Harbor, for the Navajo have always been warriors, and his upbringing on a New Mexico reservation gave him the strength—both physical and mental—to excel as a marine. During World War II, the Japanese had managed to crack every code the United States used. But when the Marines turned to its Navajo recruits to develop and implement a secret military language, they created the only unbroken code in modern warfare—and helped assure victory for the United States over Japan in the South Pacific. INCLUDES THE ACTUAL NAVAJO CODE AND RARE PICTURES"
"534","9781588344786","Nation to Nation","Suzan Shown Harjo","2014-09-30","273","Social Science","en","3.6","502","https://images.isbndb.com/covers/47/86/9781588344786.jpg","http://books.google.com.vn/books?id=M8NvDwAAQBAJ&printsec=frontcover&dq=isbn:9781588344786&hl=&cd=1&source=gbs_api","Nation to Nation explores the promises, diplomacy, and betrayals involved in treaties and treaty making between the United States government and Native Nations. One side sought to own the riches of North America and the other struggled to hold on to traditional homelands and ways of life. The book reveals how the ideas of honor, fair dealings, good faith, rule of law, and peaceful relations between nations have been tested and challenged in historical and modern times. The book consistently demonstrates how and why centuries-old treaties remain living, relevant documents for both Natives and non-Natives in the 21st century."
"535","9780805086843","Bury My Heart at Wounded Knee","Dee Brown","2007-05-15","516","History","en","3.5","747","https://images.isbndb.com/covers/68/43/9780805086843.jpg","http://books.google.com.vn/books?id=02nyRlY4rMUC&dq=isbn:9780805086843&hl=&cd=1&source=gbs_api","Immediately recognized as a revelatory and enormously controversial book since its first publication in 1971, Bury My Heart at Wounded Knee is universally recognized as one of those rare books that forever changes the way its subject is perceived. Now repackaged with a new introduction from bestselling author Hampton Sides to coincide with a major HBO dramatic film of the book, Bury My Heart at Wounded Knee. Bury My Heart at Wounded Knee is Dee Brown's classic, eloquent, meticulously documented account of the systematic destruction of the American Indian during the second half of the nineteenth century. A national bestseller in hardcover for more than a year after its initial publication, it has sold over four million copies in multiple editions and has been translated into seventeen languages. Using council records, autobiographies, and firsthand descriptions, Brown allows great chiefs and warriors of the Dakota, Ute, Sioux, Cheyenne, and other tribes to tell us in their own words of the series of battles, massacres, and broken treaties that finally left them and their people demoralized and decimated. A unique and disturbing narrative told with force and clarity, Bury My Heart at Wounded Knee changed forever our vision of how the West was won, and lost. It tells a story that should not be forgotten, and so must be retold from time to time."
"536","9780061547317","Infinity of Nations","National Museum of the American Indian","2010-10-12","324","History","en","1","882","https://images.isbndb.com/covers/73/17/9780061547317.jpg","http://books.google.com.vn/books?id=7KgCVK1a-3UC&dq=isbn:9780061547317&hl=&cd=1&source=gbs_api","The National Museum of the American Indian is one of the world's great conservators of cultural heritage, and its collections hold more than 800,000 objects spanning 13,000 years of history of the Native peoples of the Western Hemisphere, from Tierra del Fuego in the south to the Arctic in the north. Drawing on new insights from archaeology, history, and art history, Infinity of Nations uses culturally, historically, and aesthetically significant objects as a point of entry to understanding the people who created them. Following an introduction on the power of objects to engage our imagination, each chapter presents an overview of a region of the Americas and its cultural complexities, written by a noted specialist on that region. Community knowledge-keepers and an impressive new generation of Native scholars contribute highlights on objects that represent important ideas or that capture moments of social change. Together these writers create an extraordinary mosaic. What emerges is a portrait of a complex and dynamic world shaped from its earliest history by contact and exchange among peoples. Illustrated with more than 200 strikingly beautiful photographs published here for the first time, Infinity of Nations opens new avenues that extend well beyond those of conventional cultural studies. Authoritative and accessible, here is an important resource for anyone interested in learning about Native cultures of the Americas."
"537","9781593730383","“The” Red Paint People","Bruce J. Bourque","2012","208","History","en","0.6","870","https://images.isbndb.com/covers/03/83/9781593730383.jpg","http://books.google.com.vn/books?id=KzwWAQAACAAJ&dq=isbn:9781593730383&hl=&cd=1&source=gbs_api","The Swordfish Hunters or Red Paint People as they are called because of the red ochre in their burial sites, were a remarkable culture living on the coast of Maine between 4500 and 3800 years ago. They appeared, briefly flourished, and then vanished without explanation, leaving plentiful evidence of their maritime prowess, from exquisitely carved bone daggers to harpoons and fishing gear whose basic design has not been improved upon in five millennia."
"539","9781400203758","Love Does","Bob Goff","2012","242","Religion","en","1.4","489","https://images.isbndb.com/covers/37/58/9781400203758.jpg","http://books.google.com.vn/books?id=K0H1mmJZ24sC&printsec=frontcover&dq=isbn:9781400203758&hl=&cd=1&source=gbs_api","Now a New York Times Bestseller As a college student he spent 16 days in the Pacific Ocean with five guys and a crate of canned meat. As a father he took his kids on a world tour to eat ice cream with heads of state. He made friends in Uganda, and they liked him so much he became the Ugandan consul. He pursued his wife for three years before she agreed to date him. His grades weren't good enough to get into law school, so he sat on a bench outside the Dean's office for seven days until they finally let him enroll. Bob Goff has become something of a legend, and his friends consider him the world's best-kept secret. Those same friends have long insisted he write a book. What follows are paradigm shifts, musings, and stories from one of the world's most delightfully engaging and winsome people. What fuels his impact? Love. But it's not the kind of love that stops at thoughts and feelings. Bob's love takes action. Bob believes Love Does. When Love Does, life gets interesting. Each day turns into a hilarious, whimsical, meaningful chance that makes faith simple and real. Each chapter is a story that forms a book, a life. And this is one life you don't want to miss. Light and fun, unique and profound, the lessons drawn from Bob's life and attitude just might inspire you to be secretly incredible, too. Endorsements: ""If this book does not make your heart beat faster, book the next flight to Mayo Clinic "" --Bill Hybels, Senior Pastor, Willow Creek Community Church, Chairman, Willow Creek Association ""Bob Goff is a one-man tsunami of grace, a hurricane of love. He doesn't just talk about change, he really is change, as Love Does chronicles in such a vivid way. Yet, Love Does doesn't leave you feeling like you want to celebrate its author, it awakens a sense deep within that you, too, have an outrageous role to play in God's unfolding story or rescue and repair."" --Louie Giglio, Passion Conferences/Passion City Church ""An interesting and compelling story (with Young Life roots) that ends with a practical challenge and punch: 'love does' and God can use you to do it "" --Denny Rydberg, President, Young Life ""Every once in a while someone like Bob Goff shows up to remind us that some things matter a lot more than others. Love Does has a kind of 'north star' effect that will push you to refocus your life and energy on what is most significant. It doesn't just invite you to respond with your God-given potential, it invites you to become a part of what God can do beyond your potential."" --Reggie Joiner, Founder and CEO of Orange ""We liked the book a lot. Mostly, the balloons on the cover. The rest was pretty good too. Lots of stories about how God helps us."" --Aedan, Asher and Skye Peterson ages 13, 12 and 9 ""This may look like a book. It's not. It is an invitation to enter into the greatest adventure you have ever known--your life as it was meant to be lived. Hang on "" --Michael Hyatt, Author, Platform: Get Noticed in a Noisy World, MichaelHyatt.com ""Bob's ability to love people brings contagious hope and inspiration wherever he goes. The power of love showcased in this book will surely touch the hearts and souls of many people. Read Love Does and find a friend in one the world's best hidden secrets, a person who shows how love can create connection and make a difference--even across oceans."" --George Tsereteli, Deputy Chairman of the Parliament of Georgia (former Russian Republic)"
"540","9781400205264","I've Never Been to Vegas, but My Luggage Has","Mandy Hale","2014-03-18","287","Religion","en","0.6","898","https://images.isbndb.com/covers/52/64/9781400205264.jpg","http://books.google.com.vn/books?id=oE4nAgAAQBAJ&printsec=frontcover&dq=isbn:9781400205264&hl=&cd=1&source=gbs_api","Wrong turns, humiliating flops, painful heartbreaks—and happiness? Yes, believe it or not, they can go hand in hand. Blogger and author Mandy Hale, affectionately known as “The Single Woman” to her half-million social-media followers, is living an adventurous life that proves even our lowest lows and messiest mess-ups can point us toward our joy-filled destiny as single women. In I’ve Never Been To Vegas, But My Luggage Has, Mandy delivers heart-to-heart, often hilarious stories from a life filled with love and loss, glamour and goose bumps, faith and friendship, big dreams and battle scars. She shares the bittersweet euphoria of her high-school romance, the panic-stricken cluelessness of her first day on a stressful job, and the foot-in-mouth horror of her red-carpet interview with a music legend. Along the way, Mandy dollops personal anecdotes with encouraging insights. From thrilling first kisses to crushing break-ups, from soaring career milestones to promising flights that never quite got off the ground, she unfolds in often uproarious detail the zigzags along the path toward a pinnacle moment: sharing a table and a pinch-me-I’m-dreaming conversation with her lifelong hero. In the end, Mandy turns Sin City’s infamous marketing slogan on its head: What happens in her life doesn’t stay in her life. She shares even her darkest moments in witty, winsome ways that make us not only feel her pain, but also laugh with her and apply her hard-won nuggets of inspiration to our own lives. “Happily Ever After” might not look or feel quite like what we expect, but as Mandy is discovering—and as we can discover along with her—it is well within our reach."
"541","9781439153154","Tattoos on the Heart","Greg Boyle","2011-02-08","256","Biography and Autobiography","en","2.4","943","https://images.isbndb.com/covers/31/54/9781439153154.jpg","http://books.google.com.vn/books?id=Ooz8Ke9w89QC&printsec=frontcover&dq=isbn:9781439153154&hl=&cd=1&source=gbs_api","How do you fight despair and learn to meet the world with a loving heart? How do you overcome shame? Stay faithful in spite of failure? No matter where people live or what their circumstances may be, everyone needs boundless, restorative love. Gorgeous and uplifting, Tattoos on the Heart amply demonstrates the impact unconditional love can have on your life. As a pastor working in a neighborhood with the highest concentration of murderous gang activity in Los Angeles, Gregory Boyle created an organization to provide jobs, job training, and encouragement so that young people could work together and learn the mutual respect that comes from collaboration. Tattoos on the Heart is a breathtaking series of parables distilled from his twenty years in the barrio. Arranged by theme and filled with sparkling humor and glowing generosity, these essays offer a stirring look at how full our lives could be if we could find the joy in loving others and in being loved unconditionally. From giant, tattooed Cesar, shopping at JCPenney fresh out of prison, we learn how to feel worthy of God’s love. From ten-year-old Lula we learn the importance of being known and acknowledged. From Pedro we understand the kind of patience necessary to rescue someone from the darkness. In each chapter we benefit from Boyle’s wonderful, hard-earned wisdom. Inspired by faith but applicable to anyone trying to be good, these personal, unflinching stories are full of surprising revelations and observations of the community in which Boyle works and of the many lives he has helped save. Erudite, down-to-earth, and utterly heartening, these essays about universal kinship and redemption are moving examples of the power of unconditional love in difficult times and the importance of fighting despair. With Gregory Boyle’s guidance, we can recognize our own wounds in the broken lives and daunting struggles of the men and women in these parables and learn to find joy in all of the people around us. Tattoos on the Heart reminds us that no life is less valuable than another."
"542","9781439189757","The Journal of Best Practices","David Finch","2012-01-03","235","Biography and Autobiography","en","4.5","494","https://images.isbndb.com/covers/97/57/9781439189757.jpg","http://books.google.com.vn/books?id=TK-lfldPa2oC&printsec=frontcover&dq=isbn:9781439189757&hl=&cd=1&source=gbs_api","*A New York Times Bestseller* A warm and hilarious memoir by a man diagnosed with Asperger syndrome who sets out to save his relationship. Five years after David Finch married Kristen, the love of his life, they learned that he has Asperger syndrome. The diagnosis explained David’s ever-growing list of quirks and compulsions, but it didn’t make him any easier to live with. Determined to change, David set out to understand Asperger syndrome and learn to be a better husband with an endearing zeal. His methods for improving his marriage involve excessive note-taking, performance reviews, and most of all, the Journal of Best Practices: a collection of hundreds of maxims and hard-won epiphanies, including “Don’t change the radio station when she’s singing along” and “Apologies do not count when you shout them.” David transforms himself from the world’s most trying husband to the husband who tries the hardest. He becomes the husband he’d always meant to be. Filled with humor and wisdom, The Journal of Best Practices is a candid story of ruthless self-improvement, a unique window into living with an autism spectrum condition, and proof that a true heart is the key to happy marriage."
"543","9781433679599","The Love Dare","Alex Kendrick, Stephen Kendrick","2013","256","Family and Relationships","en","3.1","230","https://images.isbndb.com/covers/95/99/9781433679599.jpg","http://books.google.com.vn/books?id=SDtkAgAAQBAJ&printsec=frontcover&dq=isbn:9781433679599&hl=&cd=1&source=gbs_api","Presents a forty-day devotional of ""dares"" for parents, challenging one or both parents to understand, practice, and communicate Christ-like love to their children."
"544","9781400082858","The Sweet Potato Queens' Book of Love","Jill Conner Browne","2004-11-30","225","Humor","en","1","962","https://images.isbndb.com/covers/28/58/9781400082858.jpg","http://books.google.com.vn/books?id=JxjuG__KqEUC&printsec=frontcover&dq=isbn:9781400082858&hl=&cd=1&source=gbs_api","To know the Sweet Potato Queens is to love them, and if you haven't heard about them yet, you will. Since the early 1980s, this group of belles gone bad has been the toast of Jackson, Mississippi, with their glorious annual appearance in the St. Patrick's Day parade. In The Sweet Potato Queens' Book of Love, their royal ringleader, Jill Conner Browne, introduces the Queens to the world with this sly, hilarious manifesto about love, life, men, and the importance of being prepared. Chapters include: • The True Magic Words Guaranteed to Get Any Man to Do Your Bidding • The Five Men You Must Have in Your Life at All Times • Men Who May Need Killing, Quite Frankly • What to Eat When Tragedy Strikes, or Just for Entertainment • The Best Advice Ever Given in the Entire History of the World From tales of the infamous Sweet Potato Queens' Promise to the joys of Chocolate Stuff and Fat Mama's Knock You Naked Margaritas, this irreverent, shamelessly funny book is the gen-u-wine article."
"545","9780062351562","Act Like a Lady, Think Like a Man, Expanded Edition","Steve Harvey","2014-06-03","0","Family and Relationships","en","1.5","435","https://images.isbndb.com/covers/15/62/9780062351562.jpg","http://books.google.com.vn/books?id=cbOkngEACAAJ&dq=isbn:9780062351562&hl=&cd=1&source=gbs_api","The #1 New York Times smash bestseller Revised and expanded with new material. With over two million copies sold, Act Like a Lady, Think Like a Man has become a bestseller around the world. In conjunction with its second movie sequel to be released this summer, Steve Harvey has updated his classic with new advice and insights. Whether it’s why women should enforce a “90-Day Probation Period” before they give their men sexual “benefits”—the way Ford motor company withholds medical and dental benefits until an employee has been on the job for 3 months—or explaining to women why men would rather “fix it” than talk about it, Steve Harvey’s advice is always spot-on and laden with warmth and humor. But behind the laughter is his sincere desire to help women understand men. Now, Steve shares even more relationship wisdom. Does it feel like your man’s friends are against you? What should you know about being a wife, before you say “I Do”? Steve provides the answers to these questions and more, and offers new insights including: How to put spice into your relationship 8 sure-fire ways to keep your cool when his “ex” shows up A test for you and your partner, to see if you’re actually ready for marriage. . . or need more time A 90-day abstinence calendar, and tips for making it through this important trial period With liberal use of his own adventures in love and courtship, Act Like a Lady, Think Like a Man is an honest, compelling, and realistic examination of how men think about love and sex and what women need to know so that they can set realistic expectations of the men in their life."
"546","9780307949332","Tiny Beautiful Things","Cheryl Strayed","2012-07-10","370","Biography and Autobiography","en","0.4","185","https://images.isbndb.com/covers/93/32/9780307949332.jpg","http://books.google.com.vn/books?id=voXPKeEMMbsC&dq=isbn:9780307949332&hl=&cd=1&source=gbs_api","NATIONAL BESTSELLER • Soon to be a Hulu Original series • The internationally acclaimed author of Wild collects the best of The Rumpus's Dear Sugar advice columns plus never-before-published pieces. Rich with humor and insight—and absolute honesty—this ""wise and compassionate"" (New York Times Book Review) book is a balm for everything life throws our way. Life can be hard: your lover cheats on you; you lose a family member; you can’t pay the bills—and it can be great: you’ve had the hottest sex of your life; you get that plum job; you muster the courage to write your novel. Sugar—the once-anonymous online columnist at The Rumpus, now revealed as Cheryl Strayed, author of the bestselling memoir Wild—is the person thousands turn to for advice."
