"id","isbn13","title","authors","published_date","page_count","category","language","avg_rating","rating_count","img_url","preview_url","description"
"379","9780385530262","Orange Is the New Black","Piper Kerman","2010-04-06","322","Biography and Autobiography","en","2.7","162","https://images.isbndb.com/covers/02/62/9780385530262.jpg","http://books.google.com.vn/books?id=OrJOvJljhNAC&printsec=frontcover&dq=isbn:9780385530262&hl=&cd=1&source=gbs_api","#1 NEW YORK TIMES BESTSELLER • NOW A NETFLIX ORIGINAL SERIES With a career, a boyfriend, and a loving family, Piper Kerman barely resembles the reckless young woman who delivered a suitcase of drug money ten years before. But that past has caught up with her. Convicted and sentenced to fifteen months at the infamous federal correctional facility in Danbury, Connecticut, the well-heeled Smith College alumna is now inmate #11187–424—one of the millions of people who disappear “down the rabbit hole” of the American penal system. From her first strip search to her final release, Kerman learns to navigate this strange world with its strictly enforced codes of behavior and arbitrary rules. She meets women from all walks of life, who surprise her with small tokens of generosity, hard words of wisdom, and simple acts of acceptance. Heartbreaking, hilarious, and at times enraging, Kerman’s story offers a rare look into the lives of women in prison—why it is we lock so many away and what happens to them when they’re there. Praise for Orange Is the New Black “Fascinating . . . The true subject of this unforgettable book is female bonding and the ties that even bars can’t unbind.”—People (four stars) “I loved this book. It’s a story rich with humor, pathos, and redemption. What I did not expect from this memoir was the affection, compassion, and even reverence that Piper Kerman demonstrates for all the women she encountered while she was locked away in jail. I will never forget it.”—Elizabeth Gilbert, author of Eat, Pray, Love “This book is impossible to put down because [Kerman] could be you. Or your best friend. Or your daughter.”—Los Angeles Times “Moving . . . transcends the memoir genre’s usual self-centeredness to explore how human beings can always surprise you.”—USA Today “It’s a compelling awakening, and a harrowing one—both for the reader and for Kerman.”—Newsweek"
"380","9781451645170","Manson","Jeff Guinn","2014-08-05","512","Biography and Autobiography","en","5","879","https://images.isbndb.com/covers/51/70/9781451645170.jpg","http://books.google.com.vn/books?id=CU4dBAAAQBAJ&printsec=frontcover&dq=isbn:9781451645170&hl=&cd=1&source=gbs_api","An account of one of the most notorious criminals in American history puts Manson in the context of his times, the turbulent end of the 1960s, revealing a rock star wannabe whose killings were directly related to his musical ambitions."
"381","9780345804839","My Beloved World","Sonia Sotomayor","2014-01-07","434","Social Science","en","0.5","388","https://images.isbndb.com/covers/48/39/9780345804839.jpg","http://books.google.com.vn/books?id=a8pvDwAAQBAJ&dq=isbn:9780345804839&hl=&cd=1&source=gbs_api","#1 NATIONAL BESTSELLER • A “searching and emotionally intimate memoir” (The New York Times) told with a candor never before undertaken by a sitting Justice. This “powerful defense of empathy” (The Washington Post) is destined to become a classic of self-invention and self-discovery. The first Hispanic and third woman appointed to the United States Supreme Court, Sonia Sotomayor has become an instant American icon. In this story of human triumph that “hums with hope and exhilaration” (NPR), she recounts her life from a Bronx housing project to the federal bench, a journey that offers an inspiring testament to her own extraordinary determination and the power of believing in oneself. Here is the story of a precarious childhood, with an alcoholic father (who would die when she was nine) and a devoted but overburdened mother, and of the refuge a little girl took from the turmoil at home with her passionately spirited paternal grandmother. But it was when she was diagnosed with juvenile diabetes that the precocious Sonia recognized she must ultimately depend on herself. She would learn to give herself the insulin shots she needed to survive and soon imagined a path to a different life. With only television characters for her professional role models, and little understanding of what was involved, she determined to become a lawyer, a dream that would sustain her on an unlikely course, from valedictorian of her high school class to the highest honors at Princeton, Yale Law School, the New York County District Attorney’s office, private practice, and appointment to the Federal District Court before the age of forty. Along the way we see how she was shaped by her invaluable mentors, a failed marriage, and the modern version of extended family she has created from cherished friends and their children. Through her still-astonished eyes, America’s infinite possibilities are envisioned anew in this warm and honest book."
"382","9781476727271","Working Stiff","Judy Melinek, T.J. Mitchell","2014-08-12","288","Biography and Autobiography","en","1.8","451","https://images.isbndb.com/covers/72/71/9781476727271.jpg","http://books.google.com.vn/books?id=f2tNAgAAQBAJ&printsec=frontcover&dq=isbn:9781476727271&hl=&cd=1&source=gbs_api","“Fun…and full of smart science. Fans of CSI—the real kind—will want to read it” (The Washington Post): A young forensic pathologist’s “rookie season” as a NYC medical examiner, and the hair-raising cases that shaped her as a physician and human being. Just two months before the September 11 terrorist attacks, Dr. Judy Melinek began her training as a New York City forensic pathologist. While her husband and their toddler held down the home front, Judy threw herself into the fascinating world of death investigation—performing autopsies, investigating death scenes, counseling grieving relatives. Working Stiff chronicles Judy’s two years of training, taking readers behind the police tape of some of the most harrowing deaths in the Big Apple, including a firsthand account of the events of September 11, the subsequent anthrax bio-terrorism attack, and the disastrous crash of American Airlines Flight 587. An unvarnished portrait of the daily life of medical examiners—complete with grisly anecdotes, chilling crime scenes, and a welcome dose of gallows humor—Working Stiff offers a glimpse into the daily life of one of America’s most arduous professions, and the unexpected challenges of shuttling between the domains of the living and the dead. The body never lies—and through the murders, accidents, and suicides that land on her table, Dr. Melinek lays bare the truth behind the glamorized depictions of autopsy work on television to reveal the secret story of the real morgue. “Haunting and illuminating...the stories from her average workdays…transfix the reader with their demonstration that medical science can diagnose and console long after the heartbeat stops” (The New York Times)."
"383","9780770436346","Law of the Jungle","Paul M. Barrett","2014","0","Biography and Autobiography","en","3.9","892","https://images.isbndb.com/covers/63/46/9780770436346.jpg","http://books.google.com.vn/books?id=klk7nwEACAAJ&dq=isbn:9780770436346&hl=&cd=1&source=gbs_api","Chronicles the twenty-year legal battle between crusading lawyer Steven Donziger and Texaco/Chevron, detailing the corporation's destruction of rain forest Aboriginal homes and the extreme prosecution tactics that culminated in Donziger's indictment for racketeering."
"384","9781439184509","I Wear the Black Hat","Chuck Klosterman","2013","256","Biography and Autobiography","en","1.1","137","https://images.isbndb.com/covers/45/09/9781439184509.jpg","http://books.google.com.vn/books?id=8L_jAwAAQBAJ&printsec=frontcover&dq=isbn:9781439184509&hl=&cd=1&source=gbs_api","The cultural critic questions how modern people understand the concept of villainy, describing how his youthful idealism gave way to an adult sympathy with notorious cultural figures to offer insight into the appeal of anti-heroes."
"385","9780812994520","Just Mercy","Bryan Stevenson","2014-10-21","354","Law","en","3.5","221","https://images.isbndb.com/covers/45/20/9780812994520.jpg","http://books.google.com.vn/books?id=GYGJDQAAQBAJ&dq=isbn:9780812994520&hl=&cd=1&source=gbs_api","#1 NEW YORK TIMES BESTSELLER • NOW A MAJOR MOTION PICTURE STARRING MICHAEL B. JORDAN AND JAMIE FOXX • A powerful true story about the potential for mercy to redeem us, and a clarion call to fix our broken system of justice—from one of the most brilliant and influential lawyers of our time. “[Bryan Stevenson’s] dedication to fighting for justice and equality has inspired me and many others and made a lasting impact on our country.”—John Legend NAMED ONE OF THE MOST INFLUENTIAL BOOKS OF THE DECADE BY CNN • Named One of the Best Books of the Year by The New York Times • The Washington Post • The Boston Globe • The Seattle Times • Esquire • Time Bryan Stevenson was a young lawyer when he founded the Equal Justice Initiative, a legal practice dedicated to defending those most desperate and in need: the poor, the wrongly condemned, and women and children trapped in the farthest reaches of our criminal justice system. One of his first cases was that of Walter McMillian, a young man who was sentenced to die for a notorious murder he insisted he didn’t commit. The case drew Bryan into a tangle of conspiracy, political machination, and legal brinksmanship—and transformed his understanding of mercy and justice forever. Just Mercy is at once an unforgettable account of an idealistic, gifted young lawyer’s coming of age, a moving window into the lives of those he has defended, and an inspiring argument for compassion in the pursuit of true justice. Winner of the Carnegie Medal for Excellence in Nonfiction • Winner of the NAACP Image Award for Nonfiction • Winner of a Books for a Better Life Award • Finalist for the Los Angeles Times Book Prize • Finalist for the Kirkus Reviews Prize • An American Library Association Notable Book “Every bit as moving as To Kill a Mockingbird, and in some ways more so . . . a searing indictment of American criminal justice and a stirring testament to the salvation that fighting for the vulnerable sometimes yields.”—David Cole, The New York Review of Books “Searing, moving . . . Bryan Stevenson may, indeed, be America’s Mandela.”—Nicholas Kristof, The New York Times “You don’t have to read too long to start cheering for this man. . . . The message of this book . . . is that evil can be overcome, a difference can be made. Just Mercy will make you upset and it will make you hopeful.”—Ted Conover, The New York Times Book Review “Inspiring . . . a work of style, substance and clarity . . . Stevenson is not only a great lawyer, he’s also a gifted writer and storyteller.”—The Washington Post “As deeply moving, poignant and powerful a book as has been, and maybe ever can be, written about the death penalty.”—The Financial Times “Brilliant.”—The Philadelphia Inquirer"
"386","9781602862562","Finding Me","Michelle Knight","2014-05-06","275","Biography and Autobiography","en","3.5","307","https://images.isbndb.com/covers/25/62/9781602862562.jpg","http://books.google.com.vn/books?id=N9A_BAAAQBAJ&dq=isbn:9781602862562&hl=&cd=1&source=gbs_api","Michelle Knight, the first of the three women abducted by notorious Cleveland kidnapper Ariel Castro, recounts the full story of her years in captivity, her escape, and the powerful inner strength and capacity for hope that has helped her rebuild her life."
"387","9781497658592","The Hillside Stranglers","Darcy O'Brien","2014-07-01","333","True Crime","en","3.4","852","https://images.isbndb.com/covers/85/92/9781497658592.jpg","http://books.google.com.vn/books?id=gJS4AwAAQBAJ&printsec=frontcover&dq=isbn:9781497658592&hl=&cd=1&source=gbs_api","The riveting true crime account of the Hillside Stranglers and the horrific serial killings they unleashed on 1970s Los Angeles. For weeks that fall, the body count of sexually violated, brutally murdered young women escalated. With increasing alarm, Los Angeles newspapers headlined the deeds of a serial killer they named the Hillside Strangler. The city was held hostage by fear. But not until January 1979, more than a year later, would the mysterious disappearance of two university students near Seattle lead police to the arrest of a security guard—the handsome, charming, fast-talking Kenny Bianchi—and the discovery that the strangler was not one man but two. Compellingly, O’Brien explores the symbiotic relationship between Bianchi and his cousin Angelo Buono, their lust for women as insatiable as their hate, before examining the crimes they remorselessly perpetrated and the lives of the unsuspecting victims they claimed. Equally riveting is O’Brien’s account of the trial—one of the longest and most controversial criminal court cases in American history—with the defense team parading, one after another, expert witnesses who had been effectively duped by Bianchi’s impersonation of a man suffering multiple personality disorder. It’s one way a man might contrive to get away with murder. Like Truman Capote in In Cold Blood and Norman Mailer in The Executioner’s Song, Darcy O’Brien weds the narrative skill of an award-winning novelist with the detailed observations of an experienced investigator to unravel this chilling true-crime story."
"388","9780062248893","Deal with the Devil","Peter Lance","2013-07-02","462","True Crime","en","3.2","696","https://images.isbndb.com/covers/88/93/9780062248893.jpg","http://books.google.com.vn/books?id=TheH9kiuxcsC&printsec=frontcover&dq=isbn:9780062248893&hl=&cd=1&source=gbs_api","In Deal with the Devil, five-time Emmy Award–winning investigative reporter Peter Lance draws on three decades of once-secret FBI files to tell the definitive story of Greg Scarpa Sr., a Mafia capo who “stopped counting” after fifty murders, while secretly betraying the Colombo crime family as a Top Echelon FBI informant. Lance traces Scarpa’s shadowy relationship with the FBI all the way back to 1960, when his debriefings went straight to J. Edgar Hoover. In forty-two years of murder and racketeering, Scarpa served only thirty days in jail thanks to his secret relationship with the Feds. This is the untold story that will rewrite Mafia history as we know it —a page-turning work of journalism that reads like a Scorsese film. Deal with the Devil includes more than 130 illustrations, crime scene photos, and never-before-seen FBI documents."
"389","9780805099096","Uncertain Justice","Laurence Tribe, Joshua Matz","2014-06-03","416","Law","en","0.9","220","https://images.isbndb.com/covers/90/96/9780805099096.jpg","http://books.google.com.vn/books?id=lM1iAwAAQBAJ&dq=isbn:9780805099096&hl=&cd=1&source=gbs_api","An assessment of how the Supreme Court under Chief Justice John Roberts is significantly influencing the nation's laws and reinterpreting the Constitution includes in-depth analysis of recent rulings and their implications."
"390","9780609804193","After Silence","Nancy Venable Raine","1999-08-03","290","Social Science","en","4.8","365","https://images.isbndb.com/covers/41/93/9780609804193.jpg","http://books.google.com.vn/books?id=1uKMDQAAQBAJ&dq=isbn:9780609804193&hl=&cd=1&source=gbs_api","""Silence has the rusty taste of shame. The words shut up are the most terrible words I know. . . . The man who raped me spat these words out over and over during the hours of my attack--when I screamed, when I tried to talk him out of what he was doing, when I protested. It seemed to me that for seven years--until at last I spoke--these words had sunk into my soul and become prophecy. And it seems to me now that these words, the brutish message of tyrants, preserve the darkness that still covers this pervasive crime. The real shame, as I have learned, is to consent to them."" After Silence is Nancy Venable Raine's eloquent, profoundly moving response to her rapist's command to ""shut up,"" a command that is so often echoed by society and internalized by rape victims. Beginning with her assault by a stranger in her home in 1985, Raine's riveting narrative of the ten-year aftermath of her rape brings to light the truth that survivors of traumatic experiences know--a trauma does not end when you find yourself alive. Just as devastating as the rape itself was the silence that shrouded it, a silence born of her own feelings of shame as well as the incomprehension of others. Raine gives shape, form, and voice to the ""unspeakable"" and exposes the misconceptions and cruelties that surround this prevalent though hidden crime. With formidable power and in intimate detail, she probes the long-term psychological and physiological aftereffects of rape, its tangled sexual confusions, the treatment of rape by the media and the legal and medical professions, and contemporary cultural views of victimhood. For anyone, female or male, who has suffered from or witnessed the shattering effects of rape, After Silence inspires and points the way to healing. This landmark book is a stunning literary achievement that is a testimony to the power of language to transform the worst sort of violation and suffering into meaning and into art."
"391","9781455574131","The Good Nurse","Charles Graeber","2014-07-29","0","True Crime","en","2.3","398","https://images.isbndb.com/covers/41/31/9781455574131.jpg","http://books.google.com.vn/books?id=6sUZnwEACAAJ&dq=isbn:9781455574131&hl=&cd=1&source=gbs_api","""CHILLING."" -- Stephen King An intimate -- and frightening -- glimpse inside the mind of America's most prolific serial killer, Charles Cullen, whose 16-year long ""nursing"" career left as many as 400 dead. When nurse Charlie Cullen was arrested in 2003, journalists were quick to dub him ""The Angel of Death."" But Cullen was neither a mercy killer nor a simple monster. He was a son, a husband, a father, a best friend, and a valued caregiver. He was also implicated in the deaths of as many as 400 people, and may be the most prolific serial killer in American history. Cullen's career in the world's most trusted profession spanned sixteen years, across nine hospitals. In this riveting work of investigative journalism, Charles Graeber-the only person Cullen chose to speak with following his arrest-reveals how Cullen got away with murder for so long. Based on hundreds of hours of previously unseen and unheard footage, recordings, and records, as well as extensive interviews with homicide detectives, Cullen's friends, family, coworkers, and confidential informants and whistleblowers, plus exclusive, one-on-one interviews with Cullen, himself, THE GOOD NURSE paints a dramatic portrait of madness and the bounds of friendship, and shines a spotlight on America's medical system. A harrowing and irresistibly paced book, you'll never look at a hospital the same way again."
"392","9781626195271","The Murder of Maggie Hume","Blaine Lee Pardoe, Victoria Hester","2014","0","History","en","3.2","650","https://images.isbndb.com/covers/52/71/9781626195271.jpg","http://books.google.com.vn/books?id=wYPUAQAACAAJ&dq=isbn:9781626195271&hl=&cd=1&source=gbs_api","""This book tackles the thirty-one-year-old unsolved murder of Maggie Hume""--"
"393","9780670026036","Blood Aces","Doug J. Swanson","2014","0","Biography and Autobiography","en","0.8","805","https://images.isbndb.com/covers/60/36/9780670026036.jpg","http://books.google.com.vn/books?id=_Q0enwEACAAJ&dq=isbn:9780670026036&hl=&cd=1&source=gbs_api","""Benny Binion was many things: a cowboy, a pioneering casino owner, a gangster, a killer, and founder of the hugely successful World Series of Poker. Blood Aces tells the story of Binion's crucial role in shaping modern Las Vegas. From a Texas backwater, Binion rose to prominence on a combination of vision, determination, and brutal expediency. His formula was simple: run a good business, cultivate the big boys, kill your enemies, and own the cops. Through a mix of cold-bloodedness, native intelligence, folksiness, and philanthropy, Binion became one of the most revered figures in the history of gambling, and his showmanship, shrewdness, and violence would come to dominate the Vegas scene. Veteran journalist Doug J. Swanson uses once-secret government documents and dogged reporting to show how Binion destroyed his rivals and outsmarted his adversaries--including J. Edgar Hoover""--"
"394","9780062282712","Bad Feminist","Roxane Gay","2014-08-05","0","Social Science","en","1","113","https://images.isbndb.com/covers/27/12/9780062282712.jpg","http://books.google.com.vn/books?id=Gd6CvgEACAAJ&dq=isbn:9780062282712&hl=&cd=1&source=gbs_api","From the author of Hunger: A Memoir of (My) Body, the New York Times Bestseller and Best Book of the Year at NPR, the Boston Globe, Newsweek, and many more A collection of essays spanning politics, criticism, and feminism from one of the most-watched young cultural observers of her generation, Roxane Gay. “Pink is my favorite color. I used to say my favorite color was black to be cool, but it is pink—all shades of pink. If I have an accessory, it is probably pink. I read Vogue, and I’m not doing it ironically, though it might seem that way. I once live-tweeted the September issue.” In these funny and insightful essays, Roxane Gay takes us through the journey of her evolution as a woman (Sweet Valley High) of color (The Help) while also taking readers on a ride through culture of the last few years (Girls, Django in Chains) and commenting on the state of feminism today (abortion, Chris Brown). The portrait that emerges is not only one of an incredibly insightful woman continually growing to understand herself and our society, but also one of our culture. Bad Feminist is a sharp, funny, and spot-on look at the ways in which the culture we consume becomes who we are, and an inspiring call-to-arms of all the ways we still need to do better, coming from one of our most interesting and important cultural critics."
"395","9781451697971","Cosby","Mark Whitaker","2014-09-16","544","Biography and Autobiography","en","1.6","539","https://images.isbndb.com/covers/79/71/9781451697971.jpg","http://books.google.com.vn/books?id=BRR5BAAAQBAJ&printsec=frontcover&dq=isbn:9781451697971&hl=&cd=1&source=gbs_api","The first major biography of an American icon, comedian Bill Cosby. Based on extensive research and in-depth interviews with Cosby and more than sixty of his closest friends and associates, it is a frank, fun and fascinating account of his life and historic legacy. Far from the gentle worlds of his routines or TV shows, Cosby grew up in a Philadelphia housing project, the son of an alcoholic, largely absent father and a loving but overworked mother. With novelistic detail, award winning journalist Mark Whitaker tells the story of how, after dropping out of high school, Cosby turned his life around by joining the Navy, talking his way into college, and seizing his first breaks as a stand-up comedian. Published on the 30th anniversary of The Cosby Show, the book reveals the behind-the-scenes story of that groundbreaking sitcom as well as Cosby’s bestselling albums, breakout role on I Spy, and pioneering place in children’s TV. But it also deals with professional setbacks and personal dramas, from an affair that sparked public scandal to the murder of his only son, and the private influence of his wife of fifty years, Camille Cosby. Whitaker explores the roots of Cosby’s controversial stands on race, as well as “the Cosby effect” that helped pave the way for a black president. For any fan of Bill Cosby’s work, and any student of American television, comedy, or social history, Cosby: His Life and Times is an essential read."
"396","9780307237811","Genghis Khan and the Making of the Modern World","Jack Weatherford","2005-03-22","354","History","en","4.2","702","https://images.isbndb.com/covers/78/11/9780307237811.jpg","http://books.google.com.vn/books?id=A8Y9B5uHQcAC&printsec=frontcover&dq=isbn:9780307237811&hl=&cd=1&source=gbs_api","NEW YORK TIMES BESTSELLER • The startling true history of how one extraordinary man from a remote corner of the world created an empire that led the world into the modern age—by the author featured in Echoes of the Empire: Beyond Genghis Khan. The Mongol army led by Genghis Khan subjugated more lands and people in twenty-five years than the Romans did in four hundred. In nearly every country the Mongols conquered, they brought an unprecedented rise in cultural communication, expanded trade, and a blossoming of civilization. Vastly more progressive than his European or Asian counterparts, Genghis Khan abolished torture, granted universal religious freedom, and smashed feudal systems of aristocratic privilege. From the story of his rise through the tribal culture to the explosion of civilization that the Mongol Empire unleashed, this brilliant work of revisionist history is nothing less than the epic story of how the modern world was made."
"397","9781555976859","Geek Sublime","Vikram Chandra","2014-09-02","0","Biography and Autobiography","en","1.3","427","https://images.isbndb.com/covers/68/59/9781555976859.jpg","http://books.google.com.vn/books?id=5cFDnwEACAAJ&dq=isbn:9781555976859&hl=&cd=1&source=gbs_api","Examines the connections between the worlds of art and technology, exploring the similiarities between computer coding and writing fiction."
