"id","isbn13","title","authors","published_date","page_count","category","language","avg_rating","rating_count","img_url","preview_url","description"
"186","9780062241764","Get the Guy","Matthew Hussey","2013-04-09","207","Family and Relationships","en","2.8","504","https://images.isbndb.com/covers/17/64/9780062241764.jpg","http://books.google.com.vn/books?id=1ajRzsPAaxMC&printsec=frontcover&dq=isbn:9780062241764&hl=&cd=1&source=gbs_api","Most dating books tell you what NOT to do. Here's a book dedicated to telling you what you CAN do. In his book, Get the Guy, Matthew Hussey—relationship expert, matchmaker, and star of the reality show Ready for Love—reveals the secrets of the male mind and the fundamentals of dating and mating for a proven, revolutionary approach to help women to find lasting love. Matthew Hussey has coached thousands of high-powered CEOs, showing them how to develop confidence and build relationships that translate into professional success. Many of Matthew’s male clients pressed him for advice on how to apply his winning strategies not to just get the job, but how to get the girl. As his reputation grew, Hussey was approached by more and more women, eager to hear what he had learned about the male perspective on love and romance. From landing a first date to establishing emotional intimacy, playful flirtation to red-hot bedroom tips, Matthew’s insightfulness, irreverence, and warmth makes Get the Guy: Learn Secrets of the Male Mind to Find the Man You Want and the Love You Deserve a one-of-a-kind relationship guide and the handbook for every woman who wants to get the guy she’s been waiting for."
"187","9781401939410","The Tapping Solution","Nick Ortner","2013","0","Self-help","en","4.8","669","https://images.isbndb.com/covers/94/10/9781401939410.jpg","http://books.google.com.vn/books?id=kHDzzwEACAAJ&dq=isbn:9781401939410&hl=&cd=1&source=gbs_api","Explains how to use the Emotional Freedom Technique (EFT) to create much needed change in one's life."
"188","9781885167774","The One Thing","Gary Keller, Jay Papasan","2013","0","Business and Economics","en","2","775","https://images.isbndb.com/covers/77/74/9781885167774.jpg","http://books.google.com.vn/books?id=94ScMQEACAAJ&dq=isbn:9781885167774&hl=&cd=1&source=gbs_api","- More than 500 appearances on national bestseller lists - #1 Wall Street Journal, New York Times, and USA Today - Won 12 book awards - Translated into 35 languages - Voted Top 100 Business Book of All Time on Goodreads People are using this simple, powerful concept to focus on what matters most in their personal and work lives. Companies are helping their employees be more productive with study groups, training, and coaching. Sales teams are boosting sales. Churches are conducting classes and recommending for their members. By focusing their energy on one thing at a time people are living more rewarding lives by building their careers, strengthening their finances, losing weight and getting in shape, deepening their faith, and nurturing stronger marriages and personal relationships. YOU WANT LESS. You want fewer distractions and less on your plate. The daily barrage of e-mails, texts, tweets, messages, and meetings distract you and stress you out. The simultaneous demands of work and family are taking a toll. And what's the cost? Second-rate work, missed deadlines, smaller paychecks, fewer promotions--and lots of stress. AND YOU WANT MORE. You want more productivity from your work. More income for a better lifestyle. You want more satisfaction from life, and more time for yourself, your family, and your friends. NOW YOU CAN HAVE BOTH -- LESS AND MORE. In The ONE Thing, you'll learn to * cut through the clutter * achieve better results in less time * build momentum toward your goal* dial down the stress * overcome that overwhelmed feeling * revive your energy * stay on track * master what matters to you The ONE Thing delivers extraordinary results in every area of your life--work, personal, family, and spiritual. WHAT'S YOUR ONE THING?"
"189","9781592858491","The Gifts of Imperfection","Breň Brown","2010-08-27","158","Self-help","en","0.5","270","https://images.isbndb.com/covers/84/91/9781592858491.jpg","http://books.google.com.vn/books?id=5DT91ar7MwkC&dq=isbn:9781592858491&hl=&cd=1&source=gbs_api","The Gifts of Imperfection"
"190","9781455515486","The Plan","Lyn-Genet Recitas","2013-01-01","0","Health & Fitness","en","3.2","202","https://images.isbndb.com/covers/54/86/9781455515486.jpg","http://books.google.com.vn/books?id=MdnWnQEACAAJ&dq=isbn:9781455515486&hl=&cd=1&source=gbs_api","New York Times bestselling author and cutting-edge nutrition expert Lyn-Genet Recitas reveals the surprising truth behind the ""healthy"" foods that cause weight gain and provides personalized meal plans for rapid weight loss. Carbs and portion sizes are not the problem when it comes to weight loss, contrary to popular belief. Foods that are revered by traditional weight loss programs, such as turkey, eggs, cauliflower, beans, and tomatoes, may be healthy in a vacuum, but when combined with each person's unique chemistry, they can cause a toxic reaction that triggers weight gain, premature aging, inflammation, and a host of health problems including constipation, migraines, joint pain, and depression. Lyn-Genet's groundbreaking 20-day program helps readers finally unlock the mystery behind what does and does not work for their individual bodies. With detailed meal plans, recipes, and effective, personalized advice, you will discover how to: -Lose a half a pound a day while enjoying generous servings of foods you love -Identify your hidden trigger foods that are causing weight gain and inflammation, among other symptoms -Build a personalized healthy foods list that promotes rapid weight loss -Avoid feeling bloated, tired, or unhealthy again! Feel better, look better, and be empowered by the knowledge of what truly works best for your body!"
"191","9780345542526","What's for Dinner?","Curtis Stone","2013-04-09","0","Cooking","en","2.1","916","https://images.isbndb.com/covers/25/26/9780345542526.jpg","http://books.google.com.vn/books?id=9heNEAAAQBAJ&dq=isbn:9780345542526&hl=&cd=1&source=gbs_api","130 easy-to-make meals for every night of the week, from the host of FOX’s My Kitchen Rules Celebrity chef Curtis Stone knows life can get busy. But as a dad, he also believes that sitting down to a home-cooked meal with family and friends is one of life’s greatest gifts. In his fifth cookbook, he offers both novice cooks and seasoned chefs mouthwatering recipes that don’t rely on fancy, hard-to-find ingredients and special equipment. And he breaks them down into seven simple category: • Motivating Mondays: Healthy meals that start the week off right—Fennel-Roasted Chicken and Winter Squash with Endive-Apple Salad; Grilled Shrimp and Rice Noodle Salad • Time-Saving Tuesdays: Quick and easy recipes for simple meals—Steak and Green Bean Stir-Fry with Ginger and Garlic; Grilled Pork Chops and Vegetable Gratin with Caper-Parsley Vinaigrette • One-Pot Wednesdays: Flavorful dishes with minimal cleanup—Chicken and Chorizo Paella; Rosemary Salt-Crusted Pork Loin with Roasted Shallots, Potatoes, Carrots, and Parsnips • Thrifty Thursdays: Yummy meals on a budget—Sliders with Red Onion Marmalade and Blue Cheese; Roasted Cauliflower, Broccoli, and Pasta Bake with Cheddar • Five-Ingredient Fridays: Fun, fast recipes to kick off the weekend—Grilled Harissa Lamb Rack with Summer Succotash; Seared Scallops and Peas with Bacon and Mint • Dinner Party Saturdays: Extraordinary dishes to share with friends and family—Asian Crab Cakes with Mango Chutney; Mushroom Ragout on Creamy Grits • Family Supper Sundays: Comforting, slow-simmering food for relaxing around the table—Southern Fried Chicken; Barbecued Spareribs with Apple-Bourbon Barbecue Sauce And don’t forget sweet treats such as Peach and Almond Cobbler and Olive Oil Cake with Strawberry-Rhubarb Compote. Loaded with enticing photos, What’s for Dinner? will inspire you and bring confidence to your kitchen and happiness to your table. Praise for What’s for Dinner? “Designed to help make meal time easy, fun and tasty despite everyone’s hectic schedules.”—People “Full of simple recipes for every busy night of the week.”—The Kansas City Star “Stone delivers simple recipes, many of which can be made (start to finish) in less than 40 minutes.”—The Atlanta Journal-Constitution “What could be better than having a new arsenal of Stone's recipes at your fingertips? . . . Charming for both his accent and kitchen knowledge, this man is as down to earth as they come.”—Milwaukee Journal Sentinel “Curtis Stone gets it. . . . Family favorites, fresh ingredients, and simple prep—all of which is on display on every page of his beautiful book.”—Jenny Rosenstrach, author of Dinner: A Love Story “A visionary and entrepreneur, he hopes to inspire individuals to ditch the drive-thru and start firing up their ovens at home. . . . A day-to-day guide packed with easy, mouthwatering recipes for every night of the week.”—Spry Living “The book features a ton of delicious recipes organized by a different theme for every day of the week.”—D Magazine"
"192","9780307956392","Decisive","Chip Heath, Dan Heath","2013-03-26","0","Business and Economics","en","2.3","47","https://images.isbndb.com/covers/63/92/9780307956392.jpg","http://books.google.com.vn/books?id=aECTEAAAQBAJ&dq=isbn:9780307956392&hl=&cd=1&source=gbs_api","Chip and Dan Heath, the bestselling authors of Switch and Made to Stick, tackle one of the most critical topics in our work and personal lives: how to make better decisions. Research in psychology has revealed that our decisions are disrupted by an array of biases and irrationalities: We’re overconfident. We seek out information that supports us and downplay information that doesn’t. We get distracted by short-term emotions. When it comes to making choices, it seems, our brains are flawed instruments. Unfortunately, merely being aware of these shortcomings doesn’t fix the problem, any more than knowing that we are nearsighted helps us to see. The real question is: How can we do better? In Decisive, the Heaths, based on an exhaustive study of the decision-making literature, introduce a four-step process designed to counteract these biases. Written in an engaging and compulsively readable style, Decisive takes readers on an unforgettable journey, from a rock star’s ingenious decision-making trick to a CEO’s disastrous acquisition, to a single question that can often resolve thorny personal decisions. Along the way, we learn the answers to critical questions like these: How can we stop the cycle of agonizing over our decisions? How can we make group decisions without destructive politics? And how can we ensure that we don’t overlook precious opportunities to change our course? Decisive is the Heath brothers’ most powerful—and important—book yet, offering fresh strategies and practical tools enabling us to make better choices. Because the right decision, at the right moment, can make all the difference."
"193","9780815329152","Entrepreneurship and Innovation in Automobile Insurance","Samuel Patton Black, John Paul Rossi","2001","382","Business and Economics","en","0.5","229","https://images.isbndb.com/covers/91/52/9780815329152.jpg","http://books.google.com.vn/books?id=I1KEUjlG81oC&printsec=frontcover&dq=isbn:9780815329152&hl=&cd=1&source=gbs_api","First Published in 2001. This study explores the development of automobile insurance through the career of one of the industry's entrepreneurs, Samuel P. Black, Jr., and Erie Insurance, the company he helped build."
"194","9780930289232","Watchmen","Alan Moore, Dave Gibbons","1987","420","Comics and Graphic Novels","en","3.7","223","https://images.isbndb.com/covers/92/32/9780930289232.jpg","http://books.google.com.vn/books?id=VjPuAAAAMAAJ&dq=isbn:9780930289232&hl=&cd=1&source=gbs_api","Imagine a future where Nixon is still President, America won the Vietnam War, and the nuclear clock stands at five minutes to midnight."
"195","9781401225766","Batman R.I.P.","Grant Morrison, Tony Daniel","2010","0","Comics and Graphic Novels","en","1.9","394","https://images.isbndb.com/covers/57/66/9781401225766.jpg","http://books.google.com.vn/books?id=77PLnQEACAAJ&dq=isbn:9781401225766&hl=&cd=1&source=gbs_api","Batman is forced to wrestle with his own sanity when an adversary called the Black Glove forms a plot to make Bruce Wayne doubt his own memory and believe that he has been betrayed by his friends and lovers."
"196","9781582405308","The Walking Dead: The heart's desire (#19-24)","Robert Kirkman","2007","140","Comics and Graphic Novels","en","4.3","158","https://images.isbndb.com/covers/53/08/9781582405308.jpg","http://books.google.com.vn/books?id=oH0qAAAAYAAJ&dq=isbn:9781582405308&hl=&cd=1&source=gbs_api","No Description"
"197","9780786403578","Reading Programs for Young Adults","Martha Seif Simpson","1997-07-15","359","Language Arts & Disciplines","en","1.3","807","https://images.isbndb.com/covers/35/78/9780786403578.jpg","http://books.google.com.vn/books?id=7sT-CgAAQBAJ&printsec=frontcover&dq=isbn:9780786403578&hl=&cd=1&source=gbs_api","School and public libraries often provide programs and activities for children in preschool through the sixth grade, but there is little available to young adults. For them, libraries become a place for work--the place to research an assignment or find a book for a report--but the thought of the library as a place for enjoyment is lost. So how do librarians recapture the interest of teenagers? This just might be the answer. Here you will find theme-based units (such as Cartoon Cavalcade, Log On at the Library, Go in Style, Cruising the Mall, Space Shots, Teens on TV, and 44 others) that are designed for young adults. Each includes a display idea, suggestions for local sponsorship of prizes, a program game to encourage participation, 10 theme-related activities, curriculum tie-in activities, sample questions for use in trivia games or scavenger hunts, ideas for activity sheets, a bibliography of related works, and a list of theme-related films. The units are highly flexible, allowing any public or school library to adapt them to their particular needs."
"198","9780785133346","Love and War","Greg Pak, Fred Van Lente","2009","0","Amazons","en","3.5","411","https://images.isbndb.com/covers/33/46/9780785133346.jpg","http://books.google.com.vn/books?id=T2jGPAAACAAJ&dq=isbn:9780785133346&hl=&cd=1&source=gbs_api","When the Amazons, led by Princess Artume, kidnap Hercules' sidekick, boy genius Amadeus Cho, and attack Atlantis, Hercules tries to stop their depredations."
"199","9781401216672","Batman","Alan Moore","2008","64","Comics and Graphic Novels","en","3.9","613","https://images.isbndb.com/covers/66/72/9781401216672.jpg","http://books.google.com.vn/books?id=3gMjnwEACAAJ&dq=isbn:9781401216672&hl=&cd=1&source=gbs_api","""One bad day. According to the grinning engine of madness and mayhem known as The Joker, that's all that separates the sane from the psychotic. Freed once again from the confines of Arkham Asylum, he's out to prove his deranged point. And he's going to use Gotham's top cop, Commissioner Jim Gordon, and his brilliant and beautiful daughter Barbara to do it. Now Batman must race to stop his archnemesis before his reign of terror claims two of the Dark Knight's closest friends. Can he finally put an end to the cycle of bloodlust and lunacy that links thes two iconic foes before it leads to a fatal conclusion? And as the horrifying origin of the Clown Prince of Crime is finally revealed, will the thin line that separates Batman's nobility and The Joker's insanity snap once and for all? '' -- dust jacket."
"200","9781600102066","Scorchy Smith and the Art of Noel Sickles","Noel Sickles, Bruce Canwell","2008","0","Aeronautics","en","4.4","447","https://images.isbndb.com/covers/20/66/9781600102066.jpg","http://books.google.com.vn/books?id=bIFNvgAACAAJ&dq=isbn:9781600102066&hl=&cd=1&source=gbs_api","Reprints all the Sickles-drawn Scorchy Smith strips, with a biography of Sickles."
"202","9780785133971","Secret Invasion","No Author","2009-03-11","0","Comics and Graphic Novels","en","2.9","76","https://images.isbndb.com/covers/39/71/9780785133971.jpg","http://books.google.com.vn/books?id=iJ2UOwAACAAJ&dq=isbn:9780785133971&hl=&cd=1&source=gbs_api","When the Skrulls come to town, it's all-out war in Wakanda! The alien invaders have warships, advanced technology, super-powered soldiers, and an army that outnumbers the Wakandans ten-to-one. Cake walk, right? Think again! There's a reason Wakanda had never been conquered, and the Skrulls are about to find out why!"
"203","9780785129714","Captain America","No Author","2009-03-11","144","Comics and Graphic Novels","en","3.8","807","https://images.isbndb.com/covers/97/14/9780785129714.jpg","http://books.google.com.vn/books?id=KHihOwAACAAJ&dq=isbn:9780785129714&hl=&cd=1&source=gbs_api","After the Civil War ends, the Winter Soldier finally chooses a side--his own--but the Red Skull and his minions are up to something behind the scenes."
"204","9780785130031","X-Men","Mike Carey, Scot Eaton","2009","168","Comics and Graphic Novels","en","2.3","964","https://images.isbndb.com/covers/00/31/9780785130031.jpg","http://books.google.com.vn/books?id=jDjXPAAACAAJ&dq=isbn:9780785130031&hl=&cd=1&source=gbs_api","Professor Xavier, still recovering from a grave injury, learns from Gambit of a plot to assassinate him, and the two discover that it was set in motion decades earlier by Xavier's recently deceased enemy, Mr. Sinister."
"205","9780786425006","Marvel Graphic Novels and Related Publications","Robert G. Weiner","2008-03-17","408","Comics and Graphic Novels","en","1.4","857","https://images.isbndb.com/covers/50/06/9780786425006.jpg","http://books.google.com.vn/books?id=oL8bAQAAIAAJ&dq=isbn:9780786425006&hl=&cd=1&source=gbs_api","This work provides an extensive guide for students, fans, and collectors of Marvel Comics. Focusing on Marvel's mainstream comics, the author provides a detailed description of each comic along with a bibliographic citation listing the publication's title, writers/artists, publisher, ISBN (if available), and a plot synopsis. One appendix provides a comprehensive alphabetical index of Marvel and Marvel-related publications to 2005, while two other appendices provide selected lists of Marvel-related game books and unpublished Marvel titles."
"206","9781421528410","Naruto, Vol. 40","Masashi Kishimoto","2009-03-03","200","Comics and Graphic Novels","en","3.5","797","https://images.isbndb.com/covers/84/10/9781421528410.jpg","http://books.google.com.vn/books?id=k-iWzQEACAAJ&dq=isbn:9781421528410&hl=&cd=1&source=gbs_api","The world’s most popular ninja comic! Naruto is a young shinobi with an incorrigible knack for mischief. He’s got a wild sense of humor, but Naruto is completely serious about his mission to be the world’s greatest ninja! It's Deidara vs. Sasuke! Is even Deidara's Ultimate Art no match for the all-powerful new Sasuke? Plus, deep inside the Land of Rain lies a secret of the Akatsuki that sheds doubt on the mysterious organization's true intentions as well as their bizarre leader, Pain."
"207","9782765409496","Manuel du patrimoine en bibliothèque","Raphaële Mouren","2007","416","Bibliothèques - Fonds spéciaux - Histoire locale","fr","2.9","297","https://images.isbndb.com/covers/94/96/9782765409496.jpg","http://books.google.com.vn/books?id=bcMfzgEACAAJ&dq=isbn:9782765409496&hl=&cd=1&source=gbs_api","No Description"
"208","9782765409168","Les petites bibliothèques publiques","Bertrand Calenge","2006","272","Public libraries","fr","1","618","https://images.isbndb.com/covers/91/68/9782765409168.jpg","http://books.google.com.vn/books?id=tfYczgEACAAJ&dq=isbn:9782765409168&hl=&cd=1&source=gbs_api","No Description"
"210","9782765408932","La bibliothèque ""hors les murs""","Claudie Tabet","2004","317","Bibliothèques","fr","4.4","975","https://images.isbndb.com/covers/89/32/9782765408932.jpg","http://books.google.com.vn/books?id=klejtwAACAAJ&dq=isbn:9782765408932&hl=&cd=1&source=gbs_api","Afin d'aider à développer l'offre de lecture en direction de tous les publics, en tous lieux et sous toutes les formes, la bibliothèque doit nouer des liens étroits avec différents partenaires associatifs et institutionnels travaillant avec des populations peu enclines à fréquenter les bibliothèques publiques. Panorama de ces structures relais et exemples d'actions."
"212","9780307454546","The Girl with the Dragon Tattoo","Stieg Larsson","2009-06-23","601","Fiction","en","4.3","863","https://images.isbndb.com/covers/45/46/9780307454546.jpg","http://books.google.com.vn/books?id=o53ilir4yXcC&dq=isbn:9780307454546&hl=&cd=1&source=gbs_api","#1 NATIONAL BESTSELLER • The thrilling first book in the Millenium series featuring Lisbeth Salander: “Combine the chilly Swedish backdrop and moody psychodrama of a Bergman movie with the grisly pyrotechnics of a serial-killer thriller, then add an angry punk heroine and a down-on-his-luck investigative journalist, and you have the ingredients of Stieg Larsson’s first novel” (The New York Times). Harriet Vanger, a scion of one of Sweden's wealthiest families disappeared over forty years ago. All these years later, her aged uncle continues to seek the truth. He hires Mikael Blomkvist, a crusading journalist recently trapped by a libel conviction, to investigate. He is aided by the pierced and tattooed punk prodigy Lisbeth Salander. Together they tap into a vein of unfathomable iniquity and astonishing corruption."
"213","9780307454553","The Girl Who Played with Fire","Stieg Larsson","2010-03-23","658","Fiction","en","2","59","https://images.isbndb.com/covers/45/53/9780307454553.jpg","http://books.google.com.vn/books?id=egFFrTSbkWgC&dq=isbn:9780307454553&hl=&cd=1&source=gbs_api","#1 NATIONAL BESTSELLER • Lisbeth Salander returns in the next installment of the Girl with the Dragon Tattoo series: Part blistering espionage thriller, part riveting police procedural, and part piercing exposé on social injustice, this is a “gripping, stay-up-all-night read” (Entertainment Weekly). • Also known as the Millennium series The next installment of the Millennium series: Mikael Blomkvist, crusading publisher of the magazine Millennium, has decided to run a story that will expose an extensive sex trafficking operation. On the eve of its publication, the two reporters responsible for the article are murdered, and the fingerprints found on the murder weapon belong to his friend, the troubled genius hacker Lisbeth Salander. Blomkvist, convinced of Salander’s innocence, plunges into an investigation. Meanwhile, Salander herself is drawn into a murderous game of cat and mouse, which forces her to face her dark past. Look for the latest book in the Girl with the Dragon Tattoo series, The Girl in the Eagle's Talons, coming soon!"
"214","9780307269997","The Girl who Kicked the Hornet's Nest","Stieg Larsson","2010","563","Fiction","en","4","105","https://images.isbndb.com/covers/99/97/9780307269997.jpg","http://books.google.com.vn/books?id=-IQ786_D6nsC&dq=isbn:9780307269997&hl=&cd=1&source=gbs_api","While recovering in the hospital, Lisbeth Salander enlists the aid of journalist Mikael Blomkvist to prove her innocent of three murders and identify the corrupt politicians who have allowed her to suffer, and, on her own, Lisbeth plots revenge against the man who tried to kill her. By the best-selling author of The Girl Who Played With Fire."
"218","9780375714368","Cutting for Stone","Abraham Verghese","2010-01-26","0","Fiction","en","3.6","969","https://images.isbndb.com/covers/43/68/9780375714368.jpg","http://books.google.com.vn/books?id=fEuTEAAAQBAJ&dq=isbn:9780375714368&hl=&cd=1&source=gbs_api","NATIONAL BESTSELLER • Marion and Shiva Stone are twin brothers born of a secret union between a beautiful Indian nun and a brash British surgeon. Orphaned by their mother’s death and their father’s disappearance, bound together by a preternatural connection and a shared fascination with medicine, the twins come of age as Ethiopia hovers on the brink of revolution. Moving from Addis Ababa to New York City and back again, Cutting for Stone is an unforgettable story of love and betrayal, medicine and ordinary miracles—and two brothers whose fates are forever intertwined. This sweeping, emotionally riveting novel that ""shows how history and landscape and accidents of birth conspire to create the story of a single life"" (Los Angeles Times) is an enthralling family saga of Africa and America, doctors and patients, exile and home."
"221","9780399157110","Strategic Moves","Stuart Woods","2011","290","Fiction","en","4.3","860","https://images.isbndb.com/covers/71/10/9780399157110.jpg","http://books.google.com.vn/books?id=HL8WngEACAAJ&dq=isbn:9780399157110&hl=&cd=1&source=gbs_api","Hand-picked by a million-dollar client for his undercover dealings with MI6, Stone Barrington is made a partner at the Woodman & Weld law firm before learning that the lucrative new client may be a Bernie Madoff in disguise. By the Edgar Award-winning author of Lucid Intervals."
